{
  "$schema": "https://json-schema.org/draft/2020-12/schema",
  "$id": "https://vayu/navlink/dialect.schema.json",
  "type": "object",
  "required": ["dialect", "version", "messages"],
  "properties": {
    "dialect": { "type": "string" },
    "version": { "const": 2 },
    "enums": {
      "type": "object",
      "additionalProperties": {
        "type": "object",
        "required": ["entries"],
        "properties": {
          "doc": { "type": "string" },
          "entries": {
            "type": "array",
            "items": {
              "type": "object",
              "required": ["name", "value"],
              "properties": {
                "name":  { "type": "string", "pattern": "^[A-Z][A-Z0-9_]*$" },
                "value": { "type": "integer", "minimum": 0 },
                "doc":   { "type": "string" }
              },
              "additionalProperties": false
            }
          }
        },
        "additionalProperties": false
      }
    },
    "messages": {
      "type": "array",
      "items": {
        "type": "object",
        "required": ["msgid", "name", "fields"],
        "properties": {
          "msgid":    { "type": "integer", "minimum": 0, "maximum": 16777215 },
          "name":     { "type": "string", "pattern": "^[A-Z][A-Z0-9_]*$" },
          "replaces": { "type": ["string", "null"] },
          "doc":      { "type": "string" },
          "ack":      { "type": "boolean", "description": "Override whether the receiver owes a COMMAND_ACK. Default: true for the command range 0x002000-0x002FFF, false otherwise (spec §12.1)." },
          "fields": {
            "type": "array",
            "minItems": 1,
            "items": {
              "type": "object",
              "required": ["index", "name", "type"],
              "properties": {
                "index":     { "type": "integer", "minimum": 0 },
                "name":      { "type": "string", "pattern": "^[a-z_][a-z0-9_]*$" },
                "type":      { "enum": ["u8","i8","u16","i16","u24","u32","i32",
                                        "u64","i64","f32","f64","char"] },
                "len":       { "type": "integer", "minimum": 1 },
                "scale":     { "type": "number", "exclusiveMinimum": 0 },
                "unit":      { "type": "string" },
                "enum":      { "type": "string" },
                "default":   { "type": ["number", "string"] },
                "extension": { "type": "boolean" },
                "doc":       { "type": "string" }
              },
              "additionalProperties": false
            }
          }
        },
        "additionalProperties": false
      }
    }
  },
  "additionalProperties": false
}
