{
  "dialect": "vayu-core",
  "version": 2,

  "enums": {
    "command_result": {
      "doc": "COMMAND_ACK.result (spec §17).",
      "entries": [
        { "name": "ACCEPTED",             "value": 0 },
        { "name": "TEMPORARILY_REJECTED", "value": 1 },
        { "name": "DENIED",               "value": 2 },
        { "name": "UNSUPPORTED",          "value": 3 },
        { "name": "FAILED",               "value": 4 },
        { "name": "IN_PROGRESS",          "value": 5 }
      ]
    },
    "param_type": {
      "doc": "PARAM_VALUE.type / PARAM_SET.type (spec §17).",
      "entries": [
        { "name": "U8",  "value": 1 },  { "name": "I8",  "value": 2 },
        { "name": "U16", "value": 3 },  { "name": "I16", "value": 4 },
        { "name": "U32", "value": 5 },  { "name": "I32", "value": 6 },
        { "name": "U64", "value": 7 },  { "name": "I64", "value": 8 },
        { "name": "F32", "value": 9 },  { "name": "F64", "value": 10 }
      ]
    },
    "sec_mode": {
      "doc": "CAPABILITIES.sec_modes bitmask (spec §17).",
      "entries": [
        { "name": "NONE",    "value": 1 },
        { "name": "SIGN",    "value": 2 },
        { "name": "ENCRYPT", "value": 4 }
      ]
    },
    "nav_state": {
      "doc": "HEARTBEAT.nav_state. Sequential v2 encoding of the firmware flight-state machine.",
      "entries": [
        { "name": "UNINITIALIZED", "value": 0 },
        { "name": "INIT",          "value": 1 },
        { "name": "STANDBY",       "value": 2 },
        { "name": "PREARM",        "value": 3 },
        { "name": "ARMED",         "value": 4 },
        { "name": "IN_AIR",        "value": 5 },
        { "name": "FAILSAFE",      "value": 6 },
        { "name": "TERMINATED",    "value": 7 },
        { "name": "CALIBRATING",   "value": 8 }
      ]
    },
    "flight_mode": {
      "doc": "FLIGHT_MODE.mode / CMD_SET_FLIGHT_MODE.mode.",
      "entries": [
        { "name": "ANGLE",         "value": 0 },
        { "name": "ACRO",          "value": 1 },
        { "name": "RELEASE_TO_RC", "value": 2 }
      ]
    },
    "mode_source": {
      "doc": "Who selected the active flight mode.",
      "entries": [
        { "name": "RC",  "value": 0 },
        { "name": "GCS", "value": 1 }
      ]
    },
    "pid_controller": {
      "doc": "CMD_SET_PID.controller — which control loop.",
      "entries": [
        { "name": "ANGLE", "value": 0 },
        { "name": "RATE",  "value": 1 }
      ]
    },
    "pid_axis": {
      "doc": "CMD_SET_PID.axis / CMD_SET_GYRO_LPF.axis.",
      "entries": [
        { "name": "ROLL",  "value": 0 },
        { "name": "PITCH", "value": 1 },
        { "name": "YAW",   "value": 2 }
      ]
    },
    "severity": {
      "doc": "STATUSTEXT.severity (syslog-style).",
      "entries": [
        { "name": "EMERGENCY", "value": 0 }, { "name": "ALERT",  "value": 1 },
        { "name": "CRITICAL",  "value": 2 }, { "name": "ERROR",  "value": 3 },
        { "name": "WARNING",   "value": 4 }, { "name": "NOTICE", "value": 5 },
        { "name": "INFO",      "value": 6 }, { "name": "DEBUG",  "value": 7 }
      ]
    },
    "calib_step": {
      "doc": "CALIBRATION_STATUS.step — progress update or operator instruction (spec §14.8).",
      "entries": [
        { "name": "PROGRESS",          "value": 0 },
        { "name": "NOSE_UP",           "value": 1 },
        { "name": "NOSE_DOWN",         "value": 2 },
        { "name": "RIGHT_DOWN",        "value": 3 },
        { "name": "LEFT_DOWN",         "value": 4 },
        { "name": "UPRIGHT",           "value": 5 },
        { "name": "UPSIDE_DOWN",       "value": 6 },
        { "name": "FREE_ROT",          "value": 7 },
        { "name": "MAG_AXIS_COVERAGE", "value": 8 }
      ]
    },
    "perf_fifo_id": {
      "doc": "PERF_FIFO.fifo_id — stable ids so rows label regardless of send order (spec §14.8).",
      "entries": [
        { "name": "IMU_RAW",            "value": 0 },
        { "name": "IMU_TELEMETRY",      "value": 1 },
        { "name": "IMU_CONTROL",        "value": 2 },
        { "name": "IMU_CALIB",          "value": 3 },
        { "name": "IMU_CALIB_TELEM",    "value": 4 },
        { "name": "ATTITUDE_TELEMETRY", "value": 5 },
        { "name": "ATTITUDE_CONTROL",   "value": 6 },
        { "name": "RC_TELEMETRY",       "value": 7 },
        { "name": "RC_CONTROL",         "value": 8 },
        { "name": "TELEMETRY",          "value": 9 }
      ]
    }
  },

  "messages": [
    {
      "msgid": 0, "name": "HEARTBEAT", "replaces": "0x0",
      "doc": "~1 Hz liveness, mode, advertised capabilities, wall-clock stamp.",
      "fields": [
        { "index": 0, "name": "type",          "type": "u8",  "doc": "vehicle type" },
        { "index": 1, "name": "autopilot",     "type": "u8" },
        { "index": 2, "name": "base_mode",     "type": "u8" },
        { "index": 3, "name": "system_status", "type": "u8" },
        { "index": 4, "name": "nav_state",     "type": "u8",  "enum": "nav_state" },
        { "index": 5, "name": "capabilities",  "type": "u32", "doc": "capability bitmask (spec §13)" },
        { "index": 6, "name": "timestamp",     "type": "u32", "doc": "wall-clock [s:20|ms:12] (spec §6.1)" }
      ]
    },
    {
      "msgid": 2, "name": "SYSTEM_HEALTH", "replaces": "0x6/0x02",
      "doc": "Firmware health counters. v1: SYSTEM_STATUS origin HEALTH.",
      "fields": [
        { "index": 0, "name": "tx_overflow", "type": "u32" },
        { "index": 1, "name": "imu_drop",    "type": "u32" },
        { "index": 2, "name": "log_wrap",    "type": "u32" },
        { "index": 3, "name": "cpu_load",    "type": "u8", "unit": "%" }
      ]
    },
    {
      "msgid": 3, "name": "FLIGHT_MODE", "replaces": "0x6/0x07",
      "doc": "Active flight mode and who selected it. v1: SYSTEM_STATUS origin FLIGHT_MODE.",
      "fields": [
        { "index": 0, "name": "mode",   "type": "u8", "enum": "flight_mode" },
        { "index": 1, "name": "source", "type": "u8", "enum": "mode_source" }
      ]
    },
    {
      "msgid": 4, "name": "STATUSTEXT", "replaces": "0x7",
      "doc": "Human-readable status/log line. v1: PACKET_TYPE_LOG.",
      "fields": [
        { "index": 0, "name": "severity",  "type": "u8",   "enum": "severity" },
        { "index": 1, "name": "text",      "type": "char", "len": 50 },
        { "index": 2, "name": "id",        "type": "u16",  "doc": "groups multi-chunk messages" },
        { "index": 3, "name": "chunk_seq", "type": "u8" }
      ]
    },
    {
      "msgid": 5, "name": "COMMAND_ACK", "replaces": "0x3 (ack)",
      "doc": "Acknowledges any command, correlated by (command, req_seq).",
      "fields": [
        { "index": 0, "name": "command",       "type": "u24", "doc": "acked command's msgid" },
        { "index": 1, "name": "req_seq",       "type": "u8" },
        { "index": 2, "name": "result",        "type": "u8",  "enum": "command_result" },
        { "index": 3, "name": "progress",      "type": "u8",  "doc": "0..100 for IN_PROGRESS" },
        { "index": 4, "name": "result_param2", "type": "i32" }
      ]
    },
    {
      "msgid": 8, "name": "PING",
      "doc": "Round-trip liveness probe.",
      "fields": [
        { "index": 0, "name": "seq",    "type": "u32" },
        { "index": 1, "name": "target", "type": "u8" }
      ]
    },
    {
      "msgid": 9, "name": "CAPABILITIES",
      "doc": "Full capability list, on request at connect (spec §13). msgid_ranges omitted in this cut.",
      "fields": [
        { "index": 0, "name": "protocol_version",   "type": "u8" },
        { "index": 1, "name": "sec_modes",          "type": "u8",  "doc": "sec_mode bitmask" },
        { "index": 2, "name": "_pad",               "type": "u16" },
        { "index": 3, "name": "incompat_supported", "type": "u32", "doc": "incompat bits this peer implements" },
        { "index": 4, "name": "key_id",             "type": "u32", "doc": "non-secret shared-key id (spec §11.7)" }
      ]
    },
    {
      "msgid": 10, "name": "TIME_REFERENCE",
      "doc": "GCS → FC: establish reference epoch T0 (spec §10).",
      "fields": [
        { "index": 0, "name": "epoch_unix_s", "type": "u32" },
        { "index": 1, "name": "gcs_send_us",  "type": "u64", "unit": "us" }
      ]
    },
    {
      "msgid": 11, "name": "TIME_REFERENCE_ACK",
      "doc": "FC → GCS: NTP-style four-timestamp reply (spec §10.3).",
      "fields": [
        { "index": 0, "name": "gcs_send_us", "type": "u64", "unit": "us" },
        { "index": 1, "name": "fc_recv_us",  "type": "u64", "unit": "us" },
        { "index": 2, "name": "fc_send_us",  "type": "u64", "unit": "us" }
      ]
    },

    {
      "msgid": 1024, "name": "IMU_RAW", "replaces": "0x1",
      "doc": "Full IMU snapshot. v1: PACKET_TYPE_IMU_DATA_FULL (10×f32).",
      "fields": [
        { "index": 0, "name": "acc",            "type": "f32", "len": 3, "unit": "m/s/s" },
        { "index": 1, "name": "gyr",            "type": "f32", "len": 3, "unit": "deg/s" },
        { "index": 2, "name": "mag",            "type": "f32", "len": 3, "unit": "uT" },
        { "index": 3, "name": "temp",           "type": "f32", "unit": "degC" },
        { "index": 4, "name": "sample_time_us", "type": "u32", "unit": "us", "extension": true,
          "doc": "added in v2; old peers ignore it (spec §5.5)" }
      ]
    },
    {
      "msgid": 1025, "name": "IMU_COMPRESSED", "replaces": "0x2",
      "doc": "Delta IMU vs last IMU_RAW. v1: PACKET_TYPE_IMU_DATA_COMPRESSED (10×f16). NOTE: NavLink has no f16 type (spec §5.1); the 10 half-float bit patterns are carried as u16 and decoded by the application.",
      "fields": [
        { "index": 0, "name": "ref_seq", "type": "u8",  "doc": "seq of the IMU_RAW this deltas against" },
        { "index": 1, "name": "_pad",    "type": "u8" },
        { "index": 2, "name": "delta",   "type": "u16", "len": 10, "doc": "IEEE-754 binary16 deltas: acc[3],gyr[3],mag[3],temp" }
      ]
    },
    {
      "msgid": 1026, "name": "ATTITUDE_EULER", "replaces": "0x4",